id,slug,title_ar,title_en,summary_ar,summary_en,description_ar,description_en,image_url,start_date,end_date,start_time,end_time,timezone,location_ar,location_en,venue_ar,venue_en,registration_url,capacity,registration_deadline,event_type_ar,event_type_en,status,featured,category_id,created_at,updated_at
1,school-administration-positive-relationships,لقاء دور الإدارة المدرسية في بناء العلاقات الإيجابية,Session on School Administration Role in Building Positive Relationships,"لقاء تطويري متخصص يناقش دور الإدارة المدرسية في بناء العلاقات الإيجابية داخل المجتمع المدرسي","Specialized development session discussing the role of school administration in building positive relationships within the school community","ينظم المعهد الوطني للتطوير المهني التعليمي لقاءً تطويرياً متخصصاً حول دور الإدارة المدرسية في بناء العلاقات الإيجابية. يهدف اللقاء إلى تزويد القيادات التعليمية بالمهارات والاستراتيجيات اللازمة لبناء علاقات إيجابية وفعالة مع جميع أطراف المجتمع المدرسي، بما يشمل المعلمين والطلاب وأولياء الأمور. يتضمن اللقاء ورش عمل تفاعلية ومناقشات جماعية حول أفضل الممارسات في إدارة العلاقات الإنسانية داخل البيئة المدرسية، مما يساهم في تحسين المناخ المدرسي وتعزيز الأداء التعليمي.","The National Institute for Educational Professional Development organizes a specialized development session on the role of school administration in building positive relationships. The session aims to provide educational leaders with the necessary skills and strategies to build positive and effective relationships with all members of the school community, including teachers, students, and parents. The session includes interactive workshops and group discussions on best practices in managing human relationships within the school environment, contributing to improving the school climate and enhancing educational performance.",/images/school-leadership.jpg,2025-08-18,2025-08-18,09:00:00,12:00:00,Asia/Riyadh,افتراضي,Virtual,منصة زووم,Zoom Platform,https://niepd.futurex.sa/events/register/1,500,2025-08-15,لقاء تطويري,Development Session,published,true,2,2024-01-01,2024-01-01
2,student-activities-role-school,لقاء دور الأنشطة الطلابية في المدرسة,Session on Student Activities Role in School,"لقاء يناقش أهمية الأنشطة الطلابية ودورها في تنمية شخصية الطلاب وتعزيز التعلم","Session discussing the importance of student activities and their role in developing student personality and enhancing learning","يقيم المعهد الوطني للتطوير المهني التعليمي لقاءً متخصصاً حول دور الأنشطة الطلابية في المدرسة، والذي يهدف إلى تسليط الضوء على أهمية الأنشطة اللاصفية في تنمية شخصية الطلاب وتعزيز قدراتهم الإبداعية والقيادية. يتناول اللقاء استراتيجيات تصميم وتنفيذ الأنشطة الطلابية المتنوعة، وكيفية ربطها بالمنهج الدراسي لتحقيق أقصى استفادة تعليمية. كما يناقش اللقاء دور المعلمين والإدارة المدرسية في دعم وتفعيل هذه الأنشطة، مما يساهم في خلق بيئة تعليمية شاملة ومحفزة للإبداع والتميز.","The National Institute for Educational Professional Development holds a specialized session on the role of student activities in school, which aims to highlight the importance of extracurricular activities in developing student personality and enhancing their creative and leadership abilities. The session covers strategies for designing and implementing diverse student activities, and how to link them with the curriculum to achieve maximum educational benefit. The session also discusses the role of teachers and school administration in supporting and activating these activities, contributing to creating a comprehensive educational environment that stimulates creativity and excellence.",/images/student-activities.jpg,2025-08-25,2025-08-25,10:00:00,13:00:00,Asia/Riyadh,افتراضي,Virtual,منصة تيمز,Teams Platform,https://niepd.futurex.sa/events/register/2,300,2025-08-22,لقاء متخصص,Specialized Session,published,false,2,2024-01-01,2024-01-01
3,international-education-exhibition,المعرض الدولي للتعليم,International Education Exhibition,"المعهد الوطني للتطوير المهني التعليمي يشارك في المعرض الدولي للتعليم ويقدم ورش عمل متخصصة","National Institute for Educational Professional Development participates in International Education Exhibition and presents specialized workshops","شارك المعهد الوطني للتطوير المهني التعليمي في المعرض الدولي للتعليم، حيث قدم عرضاً شاملاً لبرامجه وخدماته التطويرية. تضمنت المشاركة تنظيم ورش عمل متخصصة حول أحدث الاتجاهات في التطوير المهني للمعلمين، بالإضافة إلى عرض التجارب الناجحة والشراكات الاستراتيجية مع الجهات المحلية والدولية. كما استعرض المعهد رؤيته المستقبلية لتطوير القطاع التعليمي في المملكة، وأهمية الاستثمار في تأهيل وتطوير الكوادر التعليمية لتحقيق أهداف رؤية 2030. لقيت مشاركة المعهد إقبالاً واسعاً من الزوار والمختصين في مجال التعليم.","The National Institute for Educational Professional Development participated in the International Education Exhibition, where it presented a comprehensive display of its programs and development services. The participation included organizing specialized workshops on the latest trends in professional development for teachers, in addition to showcasing successful experiences and strategic partnerships with local and international entities. The Institute also presented its future vision for developing the education sector in the Kingdom, and the importance of investing in qualifying and developing educational cadres to achieve Vision 2030 goals. The Institute's participation received wide interest from visitors and education specialists.",/images/education-exhibition.jpg,2025-04-15,2025-04-17,09:00:00,18:00:00,Asia/Riyadh,الرياض,Riyadh,مركز الرياض الدولي للمؤتمرات والمعارض,Riyadh International Convention & Exhibition Center,,10000,,معرض,Exhibition,published,true,2,2024-01-01,2024-01-01
4,inspiring-teacher-vision-2030-seminar,ندوة المعلم الملهم للرؤية الطموحة 2030,Inspiring Teacher for Ambitious Vision 2030 Seminar,"ندوة افتراضية تناقش دور المعلم في تحقيق أهداف رؤية المملكة 2030","Virtual seminar discussing the teacher's role in achieving Saudi Vision 2030 goals","نظم المعهد الوطني للتطوير المهني التعليمي ندوة افتراضية بعنوان 'المعلم الملهم للرؤية الطموحة 2030'، والتي افتتحها سعادة مدير عام المعهد. تناولت الندوة دور المعلم المحوري في تحقيق أهداف رؤية المملكة 2030، وأهمية التطوير المهني المستمر في إعداد جيل قادر على المنافسة عالمياً. شارك في الندوة نخبة من الخبراء والأكاديميين المتخصصين في مجال التعليم، الذين قدموا رؤى وتوجهات حول مستقبل مهنة التعليم في المملكة. كما تضمنت الندوة جلسات حوارية تفاعلية مع المشاركين حول التحديات والفرص في مجال التطوير المهني للمعلمين.","The National Institute for Educational Professional Development organized a virtual seminar titled 'Inspiring Teacher for Ambitious Vision 2030', which was opened by His Excellency the Director General of the Institute. The seminar addressed the teacher's pivotal role in achieving Saudi Vision 2030 goals, and the importance of continuous professional development in preparing a generation capable of global competition. The seminar was attended by a select group of experts and academics specialized in education, who provided insights and directions on the future of the teaching profession in the Kingdom. The seminar also included interactive dialogue sessions with participants about challenges and opportunities in professional development for teachers.",/images/inspiring-teacher-seminar.jpg,2024-06-15,2024-06-15,14:00:00,17:00:00,Asia/Riyadh,افتراضي,Virtual,منصة زووم,Zoom Platform,https://niepd.futurex.sa/events/register/4,1000,2024-06-12,ندوة,Seminar,published,true,2,2024-01-01,2024-01-01
5,assessment-for-learning-workshop,ورشة عمل حول التقويم من أجل التعلم,Workshop on Assessment for Learning,"ورشة عمل تفاعلية تركز على استراتيجيات التقويم الحديثة وتطبيقاتها في البيئة التعليمية","Interactive workshop focusing on modern assessment strategies and their applications in educational environment","ينظم المعهد الوطني للتطوير المهني التعليمي ورشة عمل تفاعلية حول التقويم من أجل التعلم، والتي تهدف إلى تطوير مهارات المعلمين في استخدام أساليب التقويم المختلفة لتحسين عملية التعلم. تتضمن الورشة جلسات عملية حول تصميم أدوات التقويم المتنوعة، وكيفية تقديم التغذية الراجعة الفعالة للطلاب، واستخدام نتائج التقويم في تطوير الممارسات التعليمية. كما تناقش الورشة أحدث الاتجاهات في مجال التقويم التربوي، بما يشمل التقويم الإلكتروني والتقويم القائم على الأداء، مما يساعد المعلمين على تطبيق أفضل الممارسات في فصولهم الدراسية.","The National Institute for Educational Professional Development organizes an interactive workshop on Assessment for Learning, which aims to develop teachers' skills in using various assessment methods to improve the learning process. The workshop includes practical sessions on designing diverse assessment tools, how to provide effective feedback to students, and using assessment results to develop educational practices. The workshop also discusses the latest trends in educational assessment, including electronic assessment and performance-based assessment, helping teachers apply best practices in their classrooms.",/images/assessment-workshop.jpg,2024-10-12,2024-10-12,09:00:00,16:00:00,Asia/Riyadh,الرياض,Riyadh,فندق الريتز كارلتون,Ritz Carlton Hotel,https://niepd.futurex.sa/events/register/5,150,2024-10-09,ورشة عمل,Workshop,published,false,6,2024-01-01,2024-01-01
